[
  {"case_id":"PRC-001","profile":"browser","payload_kind":"browser.application","scenario":"revision_order","events":[{"catalog_revision":"5","observed":"t2"},{"catalog_revision":"6","observed":"t1"}],"expected":{"head_action":"advance","history_action":"append","reason_code":"newer_numeric_revision"}},
  {"case_id":"PRC-002","profile":"browser_backend","payload_kind":"application_catalog","scenario":"revision_order","events":[{"catalog_revision":"5","observed":"t2"},{"catalog_revision":"4","observed":"t3"}],"expected":{"head_action":"retain","history_action":"append","reason_code":"superseded_stale"}},
  {"case_id":"PRC-003","profile":"browser_backend","payload_kind":"application_catalog","scenario":"duplicate","events":[{"catalog_revision":"5","record_id":"a","digest":"same"},{"catalog_revision":"5","record_id":"a","digest":"same"}],"expected":{"head_action":"retain","history_action":"deduplicate","reason_code":"exact_replay"}},
  {"case_id":"PRC-004","profile":"browser_backend","payload_kind":"application_catalog","scenario":"tie_break","events":[{"catalog_revision":"5","observed":"t2","record_id":"b","digest":"x"},{"catalog_revision":"5","observed":"t2","record_id":"a","digest":"y"}],"expected":{"head_action":"advance","history_action":"append","reason_code":"record_id_tie_break"}},
  {"case_id":"PRC-005","profile":"llm_gateway","payload_kind":"llm.entity","scenario":"late_arrival","events":[{"observed":"t2"},{"observed":"t1"}],"expected":{"head_action":"retain","history_action":"append","reason_code":"late_observation"}},
  {"case_id":"PRC-006","profile":"browser_backend","payload_kind":"application_catalog","scenario":"revision_order","events":[{"catalog_revision":"9","lifecycle":"tombstoned"},{"catalog_revision":"8","lifecycle":"observed"}],"expected":{"head_action":"retain","history_action":"append","reason_code":"stale_resurrection_blocked"}},
  {"case_id":"PRC-007","profile":"browser_backend","payload_kind":"application_catalog","scenario":"revision_order","events":[{"catalog_revision":"9","lifecycle":"tombstoned"},{"catalog_revision":"10","lifecycle":"observed"}],"expected":{"head_action":"advance","history_action":"append","reason_code":"superseding_reobservation"}},
  {"case_id":"PRC-008","profile":"endpoint","payload_kind":"endpoint.entity","scenario":"late_arrival","events":[{"observed":"t2","lifecycle":"tombstoned"},{"observed":"t3","lifecycle":"observed"}],"expected":{"head_action":"advance","history_action":"append","reason_code":"newer_reobservation"}},
  {"case_id":"PRC-009","profile":"mcp_gateway","payload_kind":"mcp.relationship","scenario":"end","events":[{"operation":"upsert","observed":"t2"},{"operation":"end","observed":"t3"}],"expected":{"head_action":"close","history_action":"append","reason_code":"source_ended"}},
  {"case_id":"PRC-010","profile":"mcp_gateway","payload_kind":"mcp.relationship","scenario":"late_arrival","events":[{"operation":"end","observed":"t3"},{"operation":"upsert","observed":"t2"}],"expected":{"head_action":"retain","history_action":"append","reason_code":"stale_resurrection_blocked"}},
  {"case_id":"PRC-011","profile":"mcp_gateway","payload_kind":"mcp.relationship","scenario":"end","events":[{"operation":"end","observed":"t3"},{"operation":"upsert","observed":"t4"}],"expected":{"head_action":"advance","history_action":"append","reason_code":"superseding_reassertion"}},
  {"case_id":"PRC-012","profile":"mcp_gateway","payload_kind":"mcp.relationship","scenario":"end","events":[{"operation":"upsert","observed":"t2"},{"operation":"end","observed":"t1"}],"expected":{"head_action":"retain","history_action":"append","reason_code":"superseded_stale"}},
  {"case_id":"PRC-013","profile":"browser","payload_kind":"browser.relationship","scenario":"retract","events":[{"state":"active","observed":"t2"},{"state":"retracted","observed":"t3"}],"expected":{"head_action":"retract","history_action":"append","reason_code":"retracted"}},
  {"case_id":"PRC-014","profile":"browser","payload_kind":"browser.relationship","scenario":"duplicate","events":[{"state":"retracted","observed":"t3"},{"state":"active","record_id":"original-replay"}],"expected":{"head_action":"retain","history_action":"deduplicate","reason_code":"consumed_input_replay"}},
  {"case_id":"PRC-015","profile":"browser","payload_kind":"browser.relationship","scenario":"retract","events":[{"support_sources":["a","b"]},{"state":"retracted","source":"a"}],"expected":{"head_action":"retain","history_action":"append","reason_code":"surviving_support"}},
  {"case_id":"PRC-016","profile":"browser","payload_kind":"browser.relationship","scenario":"retract","events":[{"state":"active","observed":"t2"},{"state":"retracted","observed":"t1"}],"expected":{"head_action":"retain","history_action":"append","reason_code":"superseded_stale"}},
  {"case_id":"PRC-017","profile":"browser","payload_kind":"browser.activity","scenario":"duplicate","events":[{"candidate":"c1","digest":"same"},{"candidate":"c1","digest":"same"}],"expected":{"head_action":"retain","history_action":"deduplicate","reason_code":"exact_replay"}},
  {"case_id":"PRC-018","profile":"browser","payload_kind":"browser.activity","scenario":"tie_break","events":[{"activity_id":"a","digest":"x"},{"activity_id":"a","digest":"y"}],"expected":{"head_action":"advance","history_action":"append","reason_code":"serialized_activity_correction"}},
  {"case_id":"PRC-019","profile":"browser","payload_kind":"browser.activity","scenario":"correction","events":[{"version":2,"visibility":"visible"},{"authorized_correction":"suppress"}],"expected":{"head_action":"advance","history_action":"append","reason_code":"suppressed_correction"}},
  {"case_id":"PRC-020","profile":"endpoint","payload_kind":"endpoint.snapshot","scenario":"revision_order","events":[{"source_revision":"7","completeness":"full"},{"source_revision":"6","completeness":"full"}],"expected":{"head_action":"retain","history_action":"append","reason_code":"stale_snapshot"}},
  {"case_id":"PRC-021","profile":"endpoint","payload_kind":"endpoint.snapshot","scenario":"duplicate","events":[{"source_revision":"7","digest":"same"},{"source_revision":"7","digest":"same"}],"expected":{"head_action":"retain","history_action":"deduplicate","reason_code":"exact_replay"}},
  {"case_id":"PRC-022","profile":"endpoint","payload_kind":"endpoint.snapshot","scenario":"tie_break","events":[{"source_revision":"7","digest":"x"},{"source_revision":"7","digest":"y"}],"expected":{"head_action":"none","history_action":"reject","reason_code":"snapshot_equivocation"}},
  {"case_id":"PRC-023","profile":"llm_gateway","payload_kind":"llm.snapshot","scenario":"late_arrival","events":[{"completed":"t2"},{"completed":"t3"}],"expected":{"head_action":"advance","history_action":"append","reason_code":"newer_snapshot_observation"}},
  {"case_id":"PRC-024","profile":"endpoint","payload_kind":"endpoint.snapshot","scenario":"late_arrival","events":[{"coverage_state":"covered","valid_from":"t2"},{"coverage_state":"covered","valid_to":"t1"}],"expected":{"head_action":"retain","history_action":"append","reason_code":"historical_coverage_interval"}},
  {"case_id":"PRC-025","profile":"mcp_gateway","payload_kind":"mcp.snapshot","scenario":"unsupported_revision","events":[{"source_revision":"7","observed":"t2"},{"source_revision":"build-8","observed":"t3"}],"expected":{"head_action":"advance","history_action":"append","reason_code":"incomparable_revision_observed_time"}}
]
